Frame 1: 76 bytes on wire (608 bits), 76 bytes captured (608 bits) on interface any, id 0
    Interface id: 0 (any)
        Interface name: any
    Encapsulation type: Linux cooked-mode capture v1 (25)
    Arrival Time: Mar 10, 2026 13:56:19.196681729 JST
    [Time shift for this packet: 0.000000000 seconds]
    Epoch Time: 1773118579.196681729 seconds
    [Time delta from previous captured frame: 0.000000000 seconds]
    [Time delta from previous displayed frame: 0.000000000 seconds]
    [Time since reference or first frame: 0.000000000 seconds]
    Frame Number: 1
    Frame Length: 76 bytes (608 bits)
    Capture Length: 76 bytes (608 bits)
    [Frame is marked: False]
    [Frame is ignored: False]
    [Protocols in frame: sll:ethertype:ip:tcp]
Linux cooked capture v1
    Packet type: Unicast to another host (3)
    Link-layer address type: Ethernet (1)
    Link-layer address length: 6
    Source: 5e:35:c7:f8:e9:d0 (5e:35:c7:f8:e9:d0)
    Unused: 0000
    Protocol: IPv4 (0x0800)
Internet Protocol Version 4, Src: 172.30.0.2, Dst: 172.30.0.3
    0100 .... = Version: 4
    .... 0101 = Header Length: 20 bytes (5)
    Differentiated Services Field: 0x00 (DSCP: CS0, ECN: Not-ECT)
        0000 00.. = Differentiated Services Codepoint: Default (0)
        .... ..00 = Explicit Congestion Notification: Not ECN-Capable Transport (0)
    Total Length: 60
    Identification: 0x6ee2 (28386)
    Flags: 0x40, Don't fragment
        0... .... = Reserved bit: Not set
        .1.. .... = Don't fragment: Set
        ..0. .... = More fragments: Not set
    ...0 0000 0000 0000 = Fragment Offset: 0
    Time to Live: 64
    Protocol: TCP (6)
    Header Checksum: 0x7398 [validation disabled]
    [Header checksum status: Unverified]
    Source Address: 172.30.0.2
    Destination Address: 172.30.0.3
Transmission Control Protocol, Src Port: 45268, Dst Port: 10443, Seq: 0, Len: 0
    Source Port: 45268
    Destination Port: 10443
    [Stream index: 0]
    [Conversation completeness: Incomplete (0)]
    [TCP Segment Len: 0]
    Sequence Number: 0    (relative sequence number)
    Sequence Number (raw): 1684778641
    [Next Sequence Number: 1    (relative sequence number)]
    Acknowledgment Number: 0
    Acknowledgment number (raw): 0
    1010 .... = Header Length: 40 bytes (10)
    Flags: 0x002 (SYN)
        000. .... .... = Reserved: Not set
        ...0 .... .... = Nonce: Not set
        .... 0... .... = Congestion Window Reduced (CWR): Not set
        .... .0.. .... = ECN-Echo: Not set
        .... ..0. .... = Urgent: Not set
        .... ...0 .... = Acknowledgment: Not set
        .... .... 0... = Push: Not set
        .... .... .0.. = Reset: Not set
        .... .... ..1. = Syn: Set
            [Expert Info (Chat/Sequence): Connection establish request (SYN): server port 10443]
                [Connection establish request (SYN): server port 10443]
                [Severity level: Chat]
                [Group: Sequence]
        .... .... ...0 = Fin: Not set
        [TCP Flags: ··········S·]
    Window: 64240
    [Calculated window size: 64240]
    Checksum: 0x5870 [unverified]
    [Checksum Status: Unverified]
    Urgent Pointer: 0
    Options: (20 bytes), Maximum segment size, SACK permitted, Timestamps, No-Operation (NOP), Window scale
        TCP Option - Maximum segment size: 1460 bytes
            Kind: Maximum Segment Size (2)
            Length: 4
            MSS Value: 1460
        TCP Option - SACK permitted
            Kind: SACK Permitted (4)
            Length: 2
        TCP Option - Timestamps: TSval 1525619534, TSecr 0
            Kind: Time Stamp Option (8)
            Length: 10
            Timestamp value: 1525619534
            Timestamp echo reply: 0
        TCP Option - No-Operation (NOP)
            Kind: No-Operation (1)
        TCP Option - Window scale: 7 (multiply by 128)
            Kind: Window Scale (3)
            Length: 3
            Shift count: 7
            [Multiplier: 128]
    [Timestamps]
        [Time since first frame in this TCP stream: 0.000000000 seconds]
        [Time since previous frame in this TCP stream: 0.000000000 seconds]

Frame 2: 76 bytes on wire (608 bits), 76 bytes captured (608 bits) on interface any, id 0
    Interface id: 0 (any)
        Interface name: any
    Encapsulation type: Linux cooked-mode capture v1 (25)
    Arrival Time: Mar 10, 2026 13:56:19.196704590 JST
    [Time shift for this packet: 0.000000000 seconds]
    Epoch Time: 1773118579.196704590 seconds
    [Time delta from previous captured frame: 0.000022861 seconds]
    [Time delta from previous displayed frame: 0.000022861 seconds]
    [Time since reference or first frame: 0.000022861 seconds]
    Frame Number: 2
    Frame Length: 76 bytes (608 bits)
    Capture Length: 76 bytes (608 bits)
    [Frame is marked: False]
    [Frame is ignored: False]
    [Protocols in frame: sll:ethertype:ip:tcp]
Linux cooked capture v1
    Packet type: Sent by us (4)
    Link-layer address type: Ethernet (1)
    Link-layer address length: 6
    Source: 5e:35:c7:f8:e9:d0 (5e:35:c7:f8:e9:d0)
    Unused: 0000
    Protocol: IPv4 (0x0800)
Internet Protocol Version 4, Src: 172.30.0.2, Dst: 172.30.0.3
    0100 .... = Version: 4
    .... 0101 = Header Length: 20 bytes (5)
    Differentiated Services Field: 0x00 (DSCP: CS0, ECN: Not-ECT)
        0000 00.. = Differentiated Services Codepoint: Default (0)
        .... ..00 = Explicit Congestion Notification: Not ECN-Capable Transport (0)
    Total Length: 60
    Identification: 0x6ee2 (28386)
    Flags: 0x40, Don't fragment
        0... .... = Reserved bit: Not set
        .1.. .... = Don't fragment: Set
        ..0. .... = More fragments: Not set
    ...0 0000 0000 0000 = Fragment Offset: 0
    Time to Live: 64
    Protocol: TCP (6)
    Header Checksum: 0x7398 [validation disabled]
    [Header checksum status: Unverified]
    Source Address: 172.30.0.2
    Destination Address: 172.30.0.3
Transmission Control Protocol, Src Port: 45268, Dst Port: 10443, Seq: 0, Len: 0
    Source Port: 45268
    Destination Port: 10443
    [Stream index: 0]
    [Conversation completeness: Incomplete, SYN_SENT (1)]
    [TCP Segment Len: 0]
    Sequence Number: 0    (relative sequence number)
    Sequence Number (raw): 1684778641
    [Next Sequence Number: 1    (relative sequence number)]
    Acknowledgment Number: 0
    Acknowledgment number (raw): 0
    1010 .... = Header Length: 40 bytes (10)
    Flags: 0x002 (SYN)
        000. .... .... = Reserved: Not set
        ...0 .... .... = Nonce: Not set
        .... 0... .... = Congestion Window Reduced (CWR): Not set
        .... .0.. .... = ECN-Echo: Not set
        .... ..0. .... = Urgent: Not set
        .... ...0 .... = Acknowledgment: Not set
        .... .... 0... = Push: Not set
        .... .... .0.. = Reset: Not set
        .... .... ..1. = Syn: Set
            [Expert Info (Chat/Sequence): Connection establish request (SYN): server port 10443]
                [Connection establish request (SYN): server port 10443]
                [Severity level: Chat]
                [Group: Sequence]
        .... .... ...0 = Fin: Not set
        [TCP Flags: ··········S·]
    Window: 64240
    [Calculated window size: 64240]
    Checksum: 0x5870 [unverified]
    [Checksum Status: Unverified]
    Urgent Pointer: 0
    Options: (20 bytes), Maximum segment size, SACK permitted, Timestamps, No-Operation (NOP), Window scale
        TCP Option - Maximum segment size: 1460 bytes
            Kind: Maximum Segment Size (2)
            Length: 4
            MSS Value: 1460
        TCP Option - SACK permitted
            Kind: SACK Permitted (4)
            Length: 2
        TCP Option - Timestamps: TSval 1525619534, TSecr 0
            Kind: Time Stamp Option (8)
            Length: 10
            Timestamp value: 1525619534
            Timestamp echo reply: 0
        TCP Option - No-Operation (NOP)
            Kind: No-Operation (1)
        TCP Option - Window scale: 7 (multiply by 128)
            Kind: Window Scale (3)
            Length: 3
            Shift count: 7
            [Multiplier: 128]
    [Timestamps]
        [Time since first frame in this TCP stream: 0.000022861 seconds]
        [Time since previous frame in this TCP stream: 0.000022861 seconds]
    [SEQ/ACK analysis]
        [TCP Analysis Flags]
            [Expert Info (Note/Sequence): A new tcp session is started with the same ports as an earlier session in this trace]
                [A new tcp session is started with the same ports as an earlier session in this trace]
                [Severity level: Note]
                [Group: Sequence]
            [Expert Info (Warning/Sequence): This frame is a (suspected) out-of-order segment]
                [This frame is a (suspected) out-of-order segment]
                [Severity level: Warning]
                [Group: Sequence]

Frame 3: 76 bytes on wire (608 bits), 76 bytes captured (608 bits) on interface any, id 0
    Interface id: 0 (any)
        Interface name: any
    Encapsulation type: Linux cooked-mode capture v1 (25)
    Arrival Time: Mar 10, 2026 13:56:19.197317673 JST
    [Time shift for this packet: 0.000000000 seconds]
    Epoch Time: 1773118579.197317673 seconds
    [Time delta from previous captured frame: 0.000613083 seconds]
    [Time delta from previous displayed frame: 0.000613083 seconds]
    [Time since reference or first frame: 0.000635944 seconds]
    Frame Number: 3
    Frame Length: 76 bytes (608 bits)
    Capture Length: 76 bytes (608 bits)
    [Frame is marked: False]
    [Frame is ignored: False]
    [Protocols in frame: sll:ethertype:ip:tcp]
Linux cooked capture v1
    Packet type: Unicast to another host (3)
    Link-layer address type: Ethernet (1)
    Link-layer address length: 6
    Source: 1a:61:65:b0:e9:59 (1a:61:65:b0:e9:59)
    Unused: 0000
    Protocol: IPv4 (0x0800)
Internet Protocol Version 4, Src: 172.30.0.3, Dst: 172.30.0.2
    0100 .... = Version: 4
    .... 0101 = Header Length: 20 bytes (5)
    Differentiated Services Field: 0x00 (DSCP: CS0, ECN: Not-ECT)
        0000 00.. = Differentiated Services Codepoint: Default (0)
        .... ..00 = Explicit Congestion Notification: Not ECN-Capable Transport (0)
    Total Length: 60
    Identification: 0x0000 (0)
    Flags: 0x40, Don't fragment
        0... .... = Reserved bit: Not set
        .1.. .... = Don't fragment: Set
        ..0. .... = More fragments: Not set
    ...0 0000 0000 0000 = Fragment Offset: 0
    Time to Live: 64
    Protocol: TCP (6)
    Header Checksum: 0xe27a [validation disabled]
    [Header checksum status: Unverified]
    Source Address: 172.30.0.3
    Destination Address: 172.30.0.2
Transmission Control Protocol, Src Port: 10443, Dst Port: 45268, Seq: 0, Ack: 1, Len: 0
    Source Port: 10443
    Destination Port: 45268
    [Stream index: 0]
    [Conversation completeness: Incomplete, SYN_SENT (1)]
    [TCP Segment Len: 0]
    Sequence Number: 0    (relative sequence number)
    Sequence Number (raw): 1003661502
    [Next Sequence Number: 1    (relative sequence number)]
    Acknowledgment Number: 1    (relative ack number)
    Acknowledgment number (raw): 1684778642
    1010 .... = Header Length: 40 bytes (10)
    Flags: 0x012 (SYN, ACK)
        000. .... .... = Reserved: Not set
        ...0 .... .... = Nonce: Not set
        .... 0... .... = Congestion Window Reduced (CWR): Not set
        .... .0.. .... = ECN-Echo: Not set
        .... ..0. .... = Urgent: Not set
        .... ...1 .... = Acknowledgment: Set
        .... .... 0... = Push: Not set
        .... .... .0.. = Reset: Not set
        .... .... ..1. = Syn: Set
            [Expert Info (Chat/Sequence): Connection establish acknowledge (SYN+ACK): server port 10443]
                [Connection establish acknowledge (SYN+ACK): server port 10443]
                [Severity level: Chat]
                [Group: Sequence]
        .... .... ...0 = Fin: Not set
        [TCP Flags: ·······A··S·]
    Window: 65160
    [Calculated window size: 65160]
    Checksum: 0x5870 [unverified]
    [Checksum Status: Unverified]
    Urgent Pointer: 0
    Options: (20 bytes), Maximum segment size, SACK permitted, Timestamps, No-Operation (NOP), Window scale
        TCP Option - Maximum segment size: 1460 bytes
            Kind: Maximum Segment Size (2)
            Length: 4
            MSS Value: 1460
        TCP Option - SACK permitted
            Kind: SACK Permitted (4)
            Length: 2
        TCP Option - Timestamps: TSval 2708769075, TSecr 1525619534
            Kind: Time Stamp Option (8)
            Length: 10
            Timestamp value: 2708769075
            Timestamp echo reply: 1525619534
        TCP Option - No-Operation (NOP)
            Kind: No-Operation (1)
        TCP Option - Window scale: 7 (multiply by 128)
            Kind: Window Scale (3)
            Length: 3
            Shift count: 7
            [Multiplier: 128]
    [Timestamps]
        [Time since first frame in this TCP stream: 0.000635944 seconds]
        [Time since previous frame in this TCP stream: 0.000613083 seconds]
    [SEQ/ACK analysis]
        [This is an ACK to the segment in frame: 1]
        [The RTT to ACK the segment was: 0.000635944 seconds]

Frame 4: 76 bytes on wire (608 bits), 76 bytes captured (608 bits) on interface any, id 0
    Interface id: 0 (any)
        Interface name: any
    Encapsulation type: Linux cooked-mode capture v1 (25)
    Arrival Time: Mar 10, 2026 13:56:19.197317673 JST
    [Time shift for this packet: 0.000000000 seconds]
    Epoch Time: 1773118579.197317673 seconds
    [Time delta from previous captured frame: 0.000000000 seconds]
    [Time delta from previous displayed frame: 0.000000000 seconds]
    [Time since reference or first frame: 0.000635944 seconds]
    Frame Number: 4
    Frame Length: 76 bytes (608 bits)
    Capture Length: 76 bytes (608 bits)
    [Frame is marked: False]
    [Frame is ignored: False]
    [Protocols in frame: sll:ethertype:ip:tcp]
Linux cooked capture v1
    Packet type: Sent by us (4)
    Link-layer address type: Ethernet (1)
    Link-layer address length: 6
    Source: 1a:61:65:b0:e9:59 (1a:61:65:b0:e9:59)
    Unused: 0000
    Protocol: IPv4 (0x0800)
Internet Protocol Version 4, Src: 172.30.0.3, Dst: 172.30.0.2
    0100 .... = Version: 4
    .... 0101 = Header Length: 20 bytes (5)
    Differentiated Services Field: 0x00 (DSCP: CS0, ECN: Not-ECT)
        0000 00.. = Differentiated Services Codepoint: Default (0)
        .... ..00 = Explicit Congestion Notification: Not ECN-Capable Transport (0)
    Total Length: 60
    Identification: 0x0000 (0)
    Flags: 0x40, Don't fragment
        0... .... = Reserved bit: Not set
        .1.. .... = Don't fragment: Set
        ..0. .... = More fragments: Not set
    ...0 0000 0000 0000 = Fragment Offset: 0
    Time to Live: 64
    Protocol: TCP (6)
    Header Checksum: 0xe27a [validation disabled]
    [Header checksum status: Unverified]
    Source Address: 172.30.0.3
    Destination Address: 172.30.0.2
Transmission Control Protocol, Src Port: 10443, Dst Port: 45268, Seq: 0, Ack: 1, Len: 0
    Source Port: 10443
    Destination Port: 45268
    [Stream index: 0]
    [Conversation completeness: Incomplete, CLIENT_ESTABLISHED (3)]
    [TCP Segment Len: 0]
    Sequence Number: 0    (relative sequence number)
    Sequence Number (raw): 1003661502
    [Next Sequence Number: 1    (relative sequence number)]
    Acknowledgment Number: 1    (relative ack number)
    Acknowledgment number (raw): 1684778642
    1010 .... = Header Length: 40 bytes (10)
    Flags: 0x012 (SYN, ACK)
        000. .... .... = Reserved: Not set
        ...0 .... .... = Nonce: Not set
        .... 0... .... = Congestion Window Reduced (CWR): Not set
        .... .0.. .... = ECN-Echo: Not set
        .... ..0. .... = Urgent: Not set
        .... ...1 .... = Acknowledgment: Set
        .... .... 0... = Push: Not set
        .... .... .0.. = Reset: Not set
        .... .... ..1. = Syn: Set
            [Expert Info (Chat/Sequence): Connection establish acknowledge (SYN+ACK): server port 10443]
                [Connection establish acknowledge (SYN+ACK): server port 10443]
                [Severity level: Chat]
                [Group: Sequence]
        .... .... ...0 = Fin: Not set
        [TCP Flags: ·······A··S·]
    Window: 65160
    [Calculated window size: 65160]
    Checksum: 0x5870 [unverified]
    [Checksum Status: Unverified]
    Urgent Pointer: 0
    Options: (20 bytes), Maximum segment size, SACK permitted, Timestamps, No-Operation (NOP), Window scale
        TCP Option - Maximum segment size: 1460 bytes
            Kind: Maximum Segment Size (2)
            Length: 4
            MSS Value: 1460
        TCP Option - SACK permitted
            Kind: SACK Permitted (4)
            Length: 2
        TCP Option - Timestamps: TSval 2708769075, TSecr 1525619534
            Kind: Time Stamp Option (8)
            Length: 10
            Timestamp value: 2708769075
            Timestamp echo reply: 1525619534
        TCP Option - No-Operation (NOP)
            Kind: No-Operation (1)
        TCP Option - Window scale: 7 (multiply by 128)
            Kind: Window Scale (3)
            Length: 3
            Shift count: 7
            [Multiplier: 128]
    [Timestamps]
        [Time since first frame in this TCP stream: 0.000635944 seconds]
        [Time since previous frame in this TCP stream: 0.000000000 seconds]
    [SEQ/ACK analysis]
        [TCP Analysis Flags]
            [Expert Info (Warning/Sequence): This frame is a (suspected) out-of-order segment]
                [This frame is a (suspected) out-of-order segment]
                [Severity level: Warning]
                [Group: Sequence]

Frame 5: 68 bytes on wire (544 bits), 68 bytes captured (544 bits) on interface any, id 0
    Interface id: 0 (any)
        Interface name: any
    Encapsulation type: Linux cooked-mode capture v1 (25)
    Arrival Time: Mar 10, 2026 13:56:19.197317673 JST
    [Time shift for this packet: 0.000000000 seconds]
    Epoch Time: 1773118579.197317673 seconds
    [Time delta from previous captured frame: 0.000000000 seconds]
    [Time delta from previous displayed frame: 0.000000000 seconds]
    [Time since reference or first frame: 0.000635944 seconds]
    Frame Number: 5
    Frame Length: 68 bytes (544 bits)
    Capture Length: 68 bytes (544 bits)
    [Frame is marked: False]
    [Frame is ignored: False]
    [Protocols in frame: sll:ethertype:ip:tcp]
Linux cooked capture v1
    Packet type: Unicast to another host (3)
    Link-layer address type: Ethernet (1)
    Link-layer address length: 6
    Source: 5e:35:c7:f8:e9:d0 (5e:35:c7:f8:e9:d0)
    Unused: 0000
    Protocol: IPv4 (0x0800)
Internet Protocol Version 4, Src: 172.30.0.2, Dst: 172.30.0.3
    0100 .... = Version: 4
    .... 0101 = Header Length: 20 bytes (5)
    Differentiated Services Field: 0x00 (DSCP: CS0, ECN: Not-ECT)
        0000 00.. = Differentiated Services Codepoint: Default (0)
        .... ..00 = Explicit Congestion Notification: Not ECN-Capable Transport (0)
    Total Length: 52
    Identification: 0x6ee3 (28387)
    Flags: 0x40, Don't fragment
        0... .... = Reserved bit: Not set
        .1.. .... = Don't fragment: Set
        ..0. .... = More fragments: Not set
    ...0 0000 0000 0000 = Fragment Offset: 0
    Time to Live: 64
    Protocol: TCP (6)
    Header Checksum: 0x739f [validation disabled]
    [Header checksum status: Unverified]
    Source Address: 172.30.0.2
    Destination Address: 172.30.0.3
Transmission Control Protocol, Src Port: 45268, Dst Port: 10443, Seq: 1, Ack: 1, Len: 0
    Source Port: 45268
    Destination Port: 10443
    [Stream index: 0]
    [Conversation completeness: Incomplete, CLIENT_ESTABLISHED (3)]
    [TCP Segment Len: 0]
    Sequence Number: 1    (relative sequence number)
    Sequence Number (raw): 1684778642
    [Next Sequence Number: 1    (relative sequence number)]
    Acknowledgment Number: 1    (relative ack number)
    Acknowledgment number (raw): 1003661503
    1000 .... = Header Length: 32 bytes (8)
    Flags: 0x010 (ACK)
        000. .... .... = Reserved: Not set
        ...0 .... .... = Nonce: Not set
        .... 0... .... = Congestion Window Reduced (CWR): Not set
        .... .0.. .... = ECN-Echo: Not set
        .... ..0. .... = Urgent: Not set
        .... ...1 .... = Acknowledgment: Set
        .... .... 0... = Push: Not set
        .... .... .0.. = Reset: Not set
        .... .... ..0. = Syn: Not set
        .... .... ...0 = Fin: Not set
        [TCP Flags: ·······A····]
    Window: 502
    [Calculated window size: 64256]
    [Window size scaling factor: 128]
    Checksum: 0x5868 [unverified]
    [Checksum Status: Unverified]
    Urgent Pointer: 0
    Options: (12 bytes), No-Operation (NOP), No-Operation (NOP), Timestamps
        TCP Option - No-Operation (NOP)
            Kind: No-Operation (1)
        TCP Option - No-Operation (NOP)
            Kind: No-Operation (1)
        TCP Option - Timestamps: TSval 1525619535, TSecr 2708769075
            Kind: Time Stamp Option (8)
            Length: 10
            Timestamp value: 1525619535
            Timestamp echo reply: 2708769075
    [Timestamps]
        [Time since first frame in this TCP stream: 0.000635944 seconds]
        [Time since previous frame in this TCP stream: 0.000000000 seconds]
    [SEQ/ACK analysis]
        [This is an ACK to the segment in frame: 3]
        [iRTT: 0.000613083 seconds]

Frame 6: 68 bytes on wire (544 bits), 68 bytes captured (544 bits) on interface any, id 0
    Interface id: 0 (any)
        Interface name: any
    Encapsulation type: Linux cooked-mode capture v1 (25)
    Arrival Time: Mar 10, 2026 13:56:19.197317673 JST
    [Time shift for this packet: 0.000000000 seconds]
    Epoch Time: 1773118579.197317673 seconds
    [Time delta from previous captured frame: 0.000000000 seconds]
    [Time delta from previous displayed frame: 0.000000000 seconds]
    [Time since reference or first frame: 0.000635944 seconds]
    Frame Number: 6
    Frame Length: 68 bytes (544 bits)
    Capture Length: 68 bytes (544 bits)
    [Frame is marked: False]
    [Frame is ignored: False]
    [Protocols in frame: sll:ethertype:ip:tcp]
Linux cooked capture v1
    Packet type: Sent by us (4)
    Link-layer address type: Ethernet (1)
    Link-layer address length: 6
    Source: 5e:35:c7:f8:e9:d0 (5e:35:c7:f8:e9:d0)
    Unused: 0000
    Protocol: IPv4 (0x0800)
Internet Protocol Version 4, Src: 172.30.0.2, Dst: 172.30.0.3
    0100 .... = Version: 4
    .... 0101 = Header Length: 20 bytes (5)
    Differentiated Services Field: 0x00 (DSCP: CS0, ECN: Not-ECT)
        0000 00.. = Differentiated Services Codepoint: Default (0)
        .... ..00 = Explicit Congestion Notification: Not ECN-Capable Transport (0)
    Total Length: 52
    Identification: 0x6ee3 (28387)
    Flags: 0x40, Don't fragment
        0... .... = Reserved bit: Not set
        .1.. .... = Don't fragment: Set
        ..0. .... = More fragments: Not set
    ...0 0000 0000 0000 = Fragment Offset: 0
    Time to Live: 64
    Protocol: TCP (6)
    Header Checksum: 0x739f [validation disabled]
    [Header checksum status: Unverified]
    Source Address: 172.30.0.2
    Destination Address: 172.30.0.3
Transmission Control Protocol, Src Port: 45268, Dst Port: 10443, Seq: 1, Ack: 1, Len: 0
    Source Port: 45268
    Destination Port: 10443
    [Stream index: 0]
    [Conversation completeness: Incomplete, ESTABLISHED (7)]
    [TCP Segment Len: 0]
    Sequence Number: 1    (relative sequence number)
    Sequence Number (raw): 1684778642
    [Next Sequence Number: 1    (relative sequence number)]
    Acknowledgment Number: 1    (relative ack number)
    Acknowledgment number (raw): 1003661503
    1000 .... = Header Length: 32 bytes (8)
    Flags: 0x010 (ACK)
        000. .... .... = Reserved: Not set
        ...0 .... .... = Nonce: Not set
        .... 0... .... = Congestion Window Reduced (CWR): Not set
        .... .0.. .... = ECN-Echo: Not set
        .... ..0. .... = Urgent: Not set
        .... ...1 .... = Acknowledgment: Set
        .... .... 0... = Push: Not set
        .... .... .0.. = Reset: Not set
        .... .... ..0. = Syn: Not set
        .... .... ...0 = Fin: Not set
        [TCP Flags: ·······A····]
    Window: 502
    [Calculated window size: 64256]
    [Window size scaling factor: 128]
    Checksum: 0x5868 [unverified]
    [Checksum Status: Unverified]
    Urgent Pointer: 0
    Options: (12 bytes), No-Operation (NOP), No-Operation (NOP), Timestamps
        TCP Option - No-Operation (NOP)
            Kind: No-Operation (1)
        TCP Option - No-Operation (NOP)
            Kind: No-Operation (1)
        TCP Option - Timestamps: TSval 1525619535, TSecr 2708769075
            Kind: Time Stamp Option (8)
            Length: 10
            Timestamp value: 1525619535
            Timestamp echo reply: 2708769075
    [Timestamps]
        [Time since first frame in this TCP stream: 0.000635944 seconds]
        [Time since previous frame in this TCP stream: 0.000000000 seconds]
    [SEQ/ACK analysis]
        [iRTT: 0.000613083 seconds]
        [TCP Analysis Flags]
            [This is a TCP duplicate ack]
        [Duplicate ACK #: 1]
        [Duplicate to the ACK in frame: 5]
            [Expert Info (Note/Sequence): Duplicate ACK (#1)]
                [Duplicate ACK (#1)]
                [Severity level: Note]
                [Group: Sequence]

Frame 7: 256 bytes on wire (2048 bits), 256 bytes captured (2048 bits) on interface any, id 0
    Interface id: 0 (any)
        Interface name: any
    Encapsulation type: Linux cooked-mode capture v1 (25)
    Arrival Time: Mar 10, 2026 13:56:19.198184180 JST
    [Time shift for this packet: 0.000000000 seconds]
    Epoch Time: 1773118579.198184180 seconds
    [Time delta from previous captured frame: 0.000866507 seconds]
    [Time delta from previous displayed frame: 0.000866507 seconds]
    [Time since reference or first frame: 0.001502451 seconds]
    Frame Number: 7
    Frame Length: 256 bytes (2048 bits)
    Capture Length: 256 bytes (2048 bits)
    [Frame is marked: False]
    [Frame is ignored: False]
    [Protocols in frame: sll:ethertype:ip:tcp:tls]
Linux cooked capture v1
    Packet type: Unicast to another host (3)
    Link-layer address type: Ethernet (1)
    Link-layer address length: 6
    Source: 5e:35:c7:f8:e9:d0 (5e:35:c7:f8:e9:d0)
    Unused: 0000
    Protocol: IPv4 (0x0800)
Internet Protocol Version 4, Src: 172.30.0.2, Dst: 172.30.0.3
    0100 .... = Version: 4
    .... 0101 = Header Length: 20 bytes (5)
    Differentiated Services Field: 0x00 (DSCP: CS0, ECN: Not-ECT)
        0000 00.. = Differentiated Services Codepoint: Default (0)
        .... ..00 = Explicit Congestion Notification: Not ECN-Capable Transport (0)
    Total Length: 240
    Identification: 0x6ee4 (28388)
    Flags: 0x40, Don't fragment
        0... .... = Reserved bit: Not set
        .1.. .... = Don't fragment: Set
        ..0. .... = More fragments: Not set
    ...0 0000 0000 0000 = Fragment Offset: 0
    Time to Live: 64
    Protocol: TCP (6)
    Header Checksum: 0x72e2 [validation disabled]
    [Header checksum status: Unverified]
    Source Address: 172.30.0.2
    Destination Address: 172.30.0.3
Transmission Control Protocol, Src Port: 45268, Dst Port: 10443, Seq: 1, Ack: 1, Len: 188
    Source Port: 45268
    Destination Port: 10443
    [Stream index: 0]
    [Conversation completeness: Incomplete, ESTABLISHED (7)]
    [TCP Segment Len: 188]
    Sequence Number: 1    (relative sequence number)
    Sequence Number (raw): 1684778642
    [Next Sequence Number: 189    (relative sequence number)]
    Acknowledgment Number: 1    (relative ack number)
    Acknowledgment number (raw): 1003661503
    1000 .... = Header Length: 32 bytes (8)
    Flags: 0x018 (PSH, ACK)
        000. .... .... = Reserved: Not set
        ...0 .... .... = Nonce: Not set
        .... 0... .... = Congestion Window Reduced (CWR): Not set
        .... .0.. .... = ECN-Echo: Not set
        .... ..0. .... = Urgent: Not set
        .... ...1 .... = Acknowledgment: Set
        .... .... 1... = Push: Set
        .... .... .0.. = Reset: Not set
        .... .... ..0. = Syn: Not set
        .... .... ...0 = Fin: Not set
        [TCP Flags: ·······AP···]
    Window: 502
    [Calculated window size: 64256]
    [Window size scaling factor: 128]
    Checksum: 0x5924 [unverified]
    [Checksum Status: Unverified]
    Urgent Pointer: 0
    Options: (12 bytes), No-Operation (NOP), No-Operation (NOP), Timestamps
        TCP Option - No-Operation (NOP)
            Kind: No-Operation (1)
        TCP Option - No-Operation (NOP)
            Kind: No-Operation (1)
        TCP Option - Timestamps: TSval 1525619536, TSecr 2708769075
            Kind: Time Stamp Option (8)
            Length: 10
            Timestamp value: 1525619536
            Timestamp echo reply: 2708769075
    [Timestamps]
        [Time since first frame in this TCP stream: 0.001502451 seconds]
        [Time since previous frame in this TCP stream: 0.000866507 seconds]
    [SEQ/ACK analysis]
        [iRTT: 0.000613083 seconds]
        [Bytes in flight: 188]
        [Bytes sent since last PSH flag: 188]
    TCP payload (188 bytes)
Transport Layer Security
    TLSv1 Record Layer: Handshake Protocol: Client Hello
        Content Type: Handshake (22)
        Version: TLS 1.0 (0x0301)
        Length: 183
        Handshake Protocol: Client Hello
            Handshake Type: Client Hello (1)
            Length: 179
            Version: TLS 1.2 (0x0303)
            Random: 138127483257ce3512473fda63bb17d5375209be971ffad5628fe3b097ab38a8
                GMT Unix Time: May 15, 1980 18:35:04.000000000 JST
                Random Bytes: 3257ce3512473fda63bb17d5375209be971ffad5628fe3b097ab38a8
            Session ID Length: 0
            Cipher Suites Length: 56
            Cipher Suites (28 suites)
                Cipher Suite: TLS_ECDHE_ECDSA_WITH_AES_256_GCM_SHA384 (0xc02c)
                Cipher Suite: TLS_ECDHE_RSA_WITH_AES_256_GCM_SHA384 (0xc030)
                Cipher Suite: TLS_DHE_RSA_WITH_AES_256_GCM_SHA384 (0x009f)
                Cipher Suite: TLS_ECDHE_ECDSA_WITH_CHACHA20_POLY1305_SHA256 (0xcca9)
                Cipher Suite: TLS_ECDHE_RSA_WITH_CHACHA20_POLY1305_SHA256 (0xcca8)
                Cipher Suite: TLS_DHE_RSA_WITH_CHACHA20_POLY1305_SHA256 (0xccaa)
                Cipher Suite: TLS_ECDHE_ECDSA_WITH_AES_128_GCM_SHA256 (0xc02b)
                Cipher Suite: TLS_ECDHE_RSA_WITH_AES_128_GCM_SHA256 (0xc02f)
                Cipher Suite: TLS_DHE_RSA_WITH_AES_128_GCM_SHA256 (0x009e)
                Cipher Suite: TLS_ECDHE_ECDSA_WITH_AES_256_CBC_SHA384 (0xc024)
                Cipher Suite: TLS_ECDHE_RSA_WITH_AES_256_CBC_SHA384 (0xc028)
                Cipher Suite: TLS_DHE_RSA_WITH_AES_256_CBC_SHA256 (0x006b)
                Cipher Suite: TLS_ECDHE_ECDSA_WITH_AES_128_CBC_SHA256 (0xc023)
                Cipher Suite: TLS_ECDHE_RSA_WITH_AES_128_CBC_SHA256 (0xc027)
                Cipher Suite: TLS_DHE_RSA_WITH_AES_128_CBC_SHA256 (0x0067)
                Cipher Suite: TLS_ECDHE_ECDSA_WITH_AES_256_CBC_SHA (0xc00a)
                Cipher Suite: TLS_ECDHE_RSA_WITH_AES_256_CBC_SHA (0xc014)
                Cipher Suite: TLS_DHE_RSA_WITH_AES_256_CBC_SHA (0x0039)
                Cipher Suite: TLS_ECDHE_ECDSA_WITH_AES_128_CBC_SHA (0xc009)
                Cipher Suite: TLS_ECDHE_RSA_WITH_AES_128_CBC_SHA (0xc013)
                Cipher Suite: TLS_DHE_RSA_WITH_AES_128_CBC_SHA (0x0033)
                Cipher Suite: TLS_RSA_WITH_AES_256_GCM_SHA384 (0x009d)
                Cipher Suite: TLS_RSA_WITH_AES_128_GCM_SHA256 (0x009c)
                Cipher Suite: TLS_RSA_WITH_AES_256_CBC_SHA256 (0x003d)
                Cipher Suite: TLS_RSA_WITH_AES_128_CBC_SHA256 (0x003c)
                Cipher Suite: TLS_RSA_WITH_AES_256_CBC_SHA (0x0035)
                Cipher Suite: TLS_RSA_WITH_AES_128_CBC_SHA (0x002f)
                Cipher Suite: TLS_EMPTY_RENEGOTIATION_INFO_SCSV (0x00ff)
            Compression Methods Length: 1
            Compression Methods (1 method)
                Compression Method: null (0)
            Extensions Length: 82
            Extension: ec_point_formats (len=4)
                Type: ec_point_formats (11)
                Length: 4
                EC point formats Length: 3
                Elliptic curves point formats (3)
                    EC point format: uncompressed (0)
                    EC point format: ansiX962_compressed_prime (1)
                    EC point format: ansiX962_compressed_char2 (2)
            Extension: supported_groups (len=12)
                Type: supported_groups (10)
                Length: 12
                Supported Groups List Length: 10
                Supported Groups (5 groups)
                    Supported Group: x25519 (0x001d)
                    Supported Group: secp256r1 (0x0017)
                    Supported Group: x448 (0x001e)
                    Supported Group: secp521r1 (0x0019)
                    Supported Group: secp384r1 (0x0018)
            Extension: session_ticket (len=0)
                Type: session_ticket (35)
                Length: 0
                Data (0 bytes)
            Extension: encrypt_then_mac (len=0)
                Type: encrypt_then_mac (22)
                Length: 0
            Extension: extended_master_secret (len=0)
                Type: extended_master_secret (23)
                Length: 0
            Extension: signature_algorithms (len=42)
                Type: signature_algorithms (13)
                Length: 42
                Signature Hash Algorithms Length: 40
                Signature Hash Algorithms (20 algorithms)
                    Signature Algorithm: ecdsa_secp256r1_sha256 (0x0403)
                        Signature Hash Algorithm Hash: SHA256 (4)
                        Signature Hash Algorithm Signature: ECDSA (3)
                    Signature Algorithm: ecdsa_secp384r1_sha384 (0x0503)
                        Signature Hash Algorithm Hash: SHA384 (5)
                        Signature Hash Algorithm Signature: ECDSA (3)
                    Signature Algorithm: ecdsa_secp521r1_sha512 (0x0603)
                        Signature Hash Algorithm Hash: SHA512 (6)
                        Signature Hash Algorithm Signature: ECDSA (3)
                    Signature Algorithm: ed25519 (0x0807)
                        Signature Hash Algorithm Hash: Unknown (8)
                        Signature Hash Algorithm Signature: Unknown (7)
                    Signature Algorithm: ed448 (0x0808)
                        Signature Hash Algorithm Hash: Unknown (8)
                        Signature Hash Algorithm Signature: Unknown (8)
                    Signature Algorithm: rsa_pss_pss_sha256 (0x0809)
                        Signature Hash Algorithm Hash: Unknown (8)
                        Signature Hash Algorithm Signature: Unknown (9)
                    Signature Algorithm: rsa_pss_pss_sha384 (0x080a)
                        Signature Hash Algorithm Hash: Unknown (8)
                        Signature Hash Algorithm Signature: Unknown (10)
                    Signature Algorithm: rsa_pss_pss_sha512 (0x080b)
                        Signature Hash Algorithm Hash: Unknown (8)
                        Signature Hash Algorithm Signature: Unknown (11)
                    Signature Algorithm: rsa_pss_rsae_sha256 (0x0804)
                        Signature Hash Algorithm Hash: Unknown (8)
                        Signature Hash Algorithm Signature: SM2 (4)
                    Signature Algorithm: rsa_pss_rsae_sha384 (0x0805)
                        Signature Hash Algorithm Hash: Unknown (8)
                        Signature Hash Algorithm Signature: Unknown (5)
                    Signature Algorithm: rsa_pss_rsae_sha512 (0x0806)
                        Signature Hash Algorithm Hash: Unknown (8)
                        Signature Hash Algorithm Signature: Unknown (6)
                    Signature Algorithm: rsa_pkcs1_sha256 (0x0401)
                        Signature Hash Algorithm Hash: SHA256 (4)
                        Signature Hash Algorithm Signature: RSA (1)
                    Signature Algorithm: rsa_pkcs1_sha384 (0x0501)
                        Signature Hash Algorithm Hash: SHA384 (5)
                        Signature Hash Algorithm Signature: RSA (1)
                    Signature Algorithm: rsa_pkcs1_sha512 (0x0601)
                        Signature Hash Algorithm Hash: SHA512 (6)
                        Signature Hash Algorithm Signature: RSA (1)
                    Signature Algorithm: SHA224 ECDSA (0x0303)
                        Signature Hash Algorithm Hash: SHA224 (3)
                        Signature Hash Algorithm Signature: ECDSA (3)
                    Signature Algorithm: SHA224 RSA (0x0301)
                        Signature Hash Algorithm Hash: SHA224 (3)
                        Signature Hash Algorithm Signature: RSA (1)
                    Signature Algorithm: SHA224 DSA (0x0302)
                        Signature Hash Algorithm Hash: SHA224 (3)
                        Signature Hash Algorithm Signature: DSA (2)
                    Signature Algorithm: SHA256 DSA (0x0402)
                        Signature Hash Algorithm Hash: SHA256 (4)
                        Signature Hash Algorithm Signature: DSA (2)
                    Signature Algorithm: SHA384 DSA (0x0502)
                        Signature Hash Algorithm Hash: SHA384 (5)
                        Signature Hash Algorithm Signature: DSA (2)
                    Signature Algorithm: SHA512 DSA (0x0602)
                        Signature Hash Algorithm Hash: SHA512 (6)
                        Signature Hash Algorithm Signature: DSA (2)
            [JA3 Fullstring: 771,49196-49200-159-52393-52392-52394-49195-49199-158-49188-49192-107-49187-49191-103-49162-49172-57-49161-49171-51-157-156-61-60-53-47-255,11-10-35-22-23-13,29-23-30-25-24,0-1-2]
            [JA3: fbe7e189e37a07ee33706f86bc746344]

Frame 8: 256 bytes on wire (2048 bits), 256 bytes captured (2048 bits) on interface any, id 0
    Interface id: 0 (any)
        Interface name: any
    Encapsulation type: Linux cooked-mode capture v1 (25)
    Arrival Time: Mar 10, 2026 13:56:19.198187610 JST
    [Time shift for this packet: 0.000000000 seconds]
    Epoch Time: 1773118579.198187610 seconds
    [Time delta from previous captured frame: 0.000003430 seconds]
    [Time delta from previous displayed frame: 0.000003430 seconds]
    [Time since reference or first frame: 0.001505881 seconds]
    Frame Number: 8
    Frame Length: 256 bytes (2048 bits)
    Capture Length: 256 bytes (2048 bits)
    [Frame is marked: False]
    [Frame is ignored: False]
    [Protocols in frame: sll:ethertype:ip:tcp]
Linux cooked capture v1
    Packet type: Sent by us (4)
    Link-layer address type: Ethernet (1)
    Link-layer address length: 6
    Source: 5e:35:c7:f8:e9:d0 (5e:35:c7:f8:e9:d0)
    Unused: 0000
    Protocol: IPv4 (0x0800)
Internet Protocol Version 4, Src: 172.30.0.2, Dst: 172.30.0.3
    0100 .... = Version: 4
    .... 0101 = Header Length: 20 bytes (5)
    Differentiated Services Field: 0x00 (DSCP: CS0, ECN: Not-ECT)
        0000 00.. = Differentiated Services Codepoint: Default (0)
        .... ..00 = Explicit Congestion Notification: Not ECN-Capable Transport (0)
    Total Length: 240
    Identification: 0x6ee4 (28388)
    Flags: 0x40, Don't fragment
        0... .... = Reserved bit: Not set
        .1.. .... = Don't fragment: Set
        ..0. .... = More fragments: Not set
    ...0 0000 0000 0000 = Fragment Offset: 0
    Time to Live: 64
    Protocol: TCP (6)
    Header Checksum: 0x72e2 [validation disabled]
    [Header checksum status: Unverified]
    Source Address: 172.30.0.2
    Destination Address: 172.30.0.3
Transmission Control Protocol, Src Port: 45268, Dst Port: 10443, Seq: 1, Ack: 1, Len: 188
    Source Port: 45268
    Destination Port: 10443
    [Stream index: 0]
